{
  "name": "1.0.20240202",
  "container": "vnmd/dcm2niix_v1.0.20240202:20241125",
  "apps": [
    "dcm2niix"
  ],
  "executables": {
    "required": [
      "dcm2niix"
    ]
  },
  "sources": [
    {
      "repo": "https://github.com/rordenlab/dcm2niix.git",
      "ref": "v1.0.20240202",
      "role": "primary"
    }
  ]
}
